{
 "mock": true,
 "schema": "fig6-sobol/assumed-v0",
 "note": "MOCK: synthetic values to exercise the template; not a result",
 "output": "barrier_het",
 "parameters": [
  {
   "symbol": "interfacial_energy",
   "S1": 0.5211,
   "S1_ci": [
    0.5027,
    0.5395
   ],
   "ST": 0.6537,
   "ST_ci": [
    0.6291,
    0.6783
   ],
   "required_precision": 0.027
  },
  {
   "symbol": "wetting_angle",
   "S1": 0.1679,
   "S1_ci": [
    0.1418,
    0.1941
   ],
   "ST": 0.2863,
   "ST_ci": [
    0.274,
    0.2985
   ],
   "required_precision": 0.0426
  },
  {
   "symbol": "ln_supersaturation",
   "S1": 0.1048,
   "S1_ci": [
    0.0843,
    0.1252
   ],
   "ST": 0.1481,
   "ST_ci": [
    0.1212,
    0.1751
   ],
   "required_precision": 0.0577
  },
  {
   "symbol": "molecular_volume",
   "S1": 0.0371,
   "S1_ci": [
    0.0124,
    0.0618
   ],
   "ST": 0.0644,
   "ST_ci": [
    0.0286,
    0.1002
   ],
   "required_precision": 0.0894
  },
  {
   "symbol": "temperature",
   "S1": 0.016,
   "S1_ci": [
    -0.0109,
    0.0428
   ],
   "ST": 0.0215,
   "ST_ci": [
    -0.0044,
    0.0474
   ],
   "required_precision": 0.1414
  },
  {
   "symbol": "kinetic_prefactor",
   "S1": 0.008,
   "S1_ci": [
    -0.0179,
    0.0339
   ],
   "ST": 0.0122,
   "ST_ci": [
    -0.0237,
    0.048
   ],
   "required_precision": 0.2
  }
 ]
}
